{
  "schema": "helix-holdout-registry/1.0",
  "policy_version": "HELIX-HOLDOUT/1.0",
  "cohort": {
    "cohort_id": "T1-LIVE-001",
    "kind": "live",
    "selection_rule": "Sealed policy _workspace/helix-direction/T1/selection-policy.md sha256=8a46c9be3d9c25a165a627b6410170d0406053271d75bf0dd9402f0cc8f29789: seven fixed GitHub topic searches, stars-desc, fixed filters, no replacement",
    "selection_cutoff": "search-evidence-bundle-sha256:be3f876812814eb02149f9a8caec571f7ef08281cd837a574014573371dc69e3",
    "commitment_sha256": "f0794d1580eb9e0698c1fffa7a44f178f53042ba008d1c0249111f92ff1b06dc",
    "minimum_candidates": 20,
    "status": "locked"
  },
  "leakage_control": {
    "excluded_registries": [
      "seed/condense/layered-corpus.json",
      "seed/condense/forward-candidate-artifacts.json"
    ],
    "excluded_source_hashes": [],
    "excluded_family_ids": [
      "sadpig70"
    ],
    "forbidden_candidate_fields": [
      "expected",
      "machines",
      "machine_id",
      "action",
      "expected_action",
      "platform",
      "platform_hint",
      "oracle_rationale"
    ],
    "predictor_forbidden_paths": [
      "seed/evaluation/t1-oracles"
    ],
    "overlap_policy": "exclude_locked_no_replacement"
  },
  "scoring": {
    "coverage_denominator": "locked_eligible_candidates",
    "score_denominator": "locked_eligible_candidates",
    "credits": {
      "exact": 1,
      "wrong": 0,
      "abstain": 0,
      "missing_artifact": 0,
      "protocol_violation": 0
    },
    "minimum_coverage": 0.8,
    "minimum_macro_f1": 0.8
  },
  "reveal_authority": {
    "required_approvals": 1,
    "allowed_roles": [
      "reveal_approver"
    ],
    "prediction_seal_required": true,
    "commitment_match_required": true
  },
  "candidates": [
    {
      "candidate_id": "T1-001",
      "status": "eligible",
      "source": {
        "kind": "local_snapshot",
        "locator": "seed/evaluation/t1-holdout/sources/T1-001.README.md",
        "immutable_revision": "e32f05b375379d887bd3766b40f993c70d39db54",
        "artifact_sha256": "d49e4a3f0b9b2e708c33367ca4f04d79167b4ebbe55e10529be911a7514196e5",
        "family_id": "iflytek",
        "license_id": "Apache-2.0",
        "license_evidence_path": "seed/evaluation/t1-holdout/licenses/T1-001.LICENSE.txt",
        "license_evidence_sha256": "3fe70565009e4b7b70e42b0b51a9b63c504658ed5c8a68b2475a02146f8ff9da"
      },
      "eligibility": {
        "source_hash_unseen": true,
        "family_unseen": true,
        "registry_overlap": false,
        "license_allowed": true,
        "reasons": []
      },
      "candidate_view": {
        "path": "seed/evaluation/t1-holdout/candidates/T1-001.view.json",
        "sha256": "45bac1558caaf71638eeecc4ad7a5c1df9dc4a8e5e16ec7e0d4285160b78bd04",
        "builder_role": "candidate_builder",
        "label_free": true
      },
      "oracle_commitment": {
        "path": "seed/evaluation/t1-oracles/T1-001.oracle.json",
        "sha256": "de4ecf5ff35486d0c6b5c46d6b520871ffeb4bd275f458db8e9708b39d8c1bc3",
        "author_role": "oracle_author",
        "access": "sealed"
      },
      "prediction_receipt": {
        "status": "absent",
        "path": null,
        "sha256": null,
        "predictor_role": "predictor"
      },
      "reveal": {
        "status": "sealed",
        "authorized_by": [],
        "receipt_sha256": null
      }
    },
    {
      "candidate_id": "T1-002",
      "status": "eligible",
      "source": {
        "kind": "local_snapshot",
        "locator": "seed/evaluation/t1-holdout/sources/T1-002.README.md",
        "immutable_revision": "dbf8432604ec97734bcfb3dc6df61f4faa0d1b84",
        "artifact_sha256": "6b43ba99c2425f3c98d2eee9377310a8e3a85aff666c55f99f5ceb463892529b",
        "family_id": "collectiveidea",
        "license_id": "MIT",
        "license_evidence_path": "seed/evaluation/t1-holdout/licenses/T1-002.LICENSE.txt",
        "license_evidence_sha256": "92db5cfdbb79fd39c1a53124129c3633f1228768ed61a57a790ceb95c82a1ce6"
      },
      "eligibility": {
        "source_hash_unseen": true,
        "family_unseen": true,
        "registry_overlap": false,
        "license_allowed": true,
        "reasons": []
      },
      "candidate_view": {
        "path": "seed/evaluation/t1-holdout/candidates/T1-002.view.json",
        "sha256": "c0e575f8a08d5ef2af300cc2cdf9089ef165ef4bd268f34c2bc8d63749f76db4",
        "builder_role": "candidate_builder",
        "label_free": true
      },
      "oracle_commitment": {
        "path": "seed/evaluation/t1-oracles/T1-002.oracle.json",
        "sha256": "ed9bc276722b083994b88374269f6c6e35f0cdf04bf1775e079a2359a545be13",
        "author_role": "oracle_author",
        "access": "sealed"
      },
      "prediction_receipt": {
        "status": "absent",
        "path": null,
        "sha256": null,
        "predictor_role": "predictor"
      },
      "reveal": {
        "status": "sealed",
        "authorized_by": [],
        "receipt_sha256": null
      }
    },
    {
      "candidate_id": "T1-003",
      "status": "eligible",
      "source": {
        "kind": "local_snapshot",
        "locator": "seed/evaluation/t1-holdout/sources/T1-003.README.md",
        "immutable_revision": "437cbbb8252beed08f2887c3605f558b2ad1201e",
        "artifact_sha256": "97e097506374bb35207867ed491f3045be8a1852bbfa4bb8f41c19876299126d",
        "family_id": "thepirat000",
        "license_id": "MIT",
        "license_evidence_path": "seed/evaluation/t1-holdout/licenses/T1-003.LICENSE.txt",
        "license_evidence_sha256": "5d0b25a172c8923384edd2bf1d06d665749c3d6ec1ed27cba6f4131b9cb5bcf6"
      },
      "eligibility": {
        "source_hash_unseen": true,
        "family_unseen": true,
        "registry_overlap": false,
        "license_allowed": true,
        "reasons": []
      },
      "candidate_view": {
        "path": "seed/evaluation/t1-holdout/candidates/T1-003.view.json",
        "sha256": "4f2ee31b5d3e1ac00ea4fe85f4a9eeed7a41fc00a41985ce73c308bc91d21003",
        "builder_role": "candidate_builder",
        "label_free": true
      },
      "oracle_commitment": {
        "path": "seed/evaluation/t1-oracles/T1-003.oracle.json",
        "sha256": "f65b155764680ba3cca83b84c1c723bc6b0f5dff6f9b18bce320c564bbb3b9a1",
        "author_role": "oracle_author",
        "access": "sealed"
      },
      "prediction_receipt": {
        "status": "absent",
        "path": null,
        "sha256": null,
        "predictor_role": "predictor"
      },
      "reveal": {
        "status": "sealed",
        "authorized_by": [],
        "receipt_sha256": null
      }
    },
    {
      "candidate_id": "T1-004",
      "status": "excluded",
      "source": {
        "kind": "local_snapshot",
        "locator": "seed/evaluation/t1-holdout/sources/T1-004.metadata.json",
        "immutable_revision": "unpinned-excluded",
        "artifact_sha256": "c2b75769496253df44e2bab402b0f63babf2862f9ffda8f3cb09dcced3203acc",
        "family_id": "pgaudit",
        "license_id": "NOASSERTION",
        "license_evidence_path": "seed/evaluation/t1-holdout/sources/T1-004.metadata.json",
        "license_evidence_sha256": "c2b75769496253df44e2bab402b0f63babf2862f9ffda8f3cb09dcced3203acc"
      },
      "eligibility": {
        "source_hash_unseen": true,
        "family_unseen": true,
        "registry_overlap": false,
        "license_allowed": false,
        "reasons": [
          "filter1: license 'NOASSERTION' not in allowlist",
          "license NOASSERTION not in allowlist"
        ]
      },
      "candidate_view": {
        "path": "seed/evaluation/t1-holdout/candidates/T1-004.view.json",
        "sha256": "0f2f4436c59c75ac7bf642d8900bd703e4ef997a8c6f2145ad53ff57a13c4bda",
        "builder_role": "candidate_builder",
        "label_free": true
      },
      "oracle_commitment": {
        "path": "seed/evaluation/t1-oracles/T1-004.oracle.json",
        "sha256": "53fa3498ecbb412cdc2c291187e71fbe958782a60f4c3e50403392556d029da1",
        "author_role": "oracle_author",
        "access": "sealed"
      },
      "prediction_receipt": {
        "status": "absent",
        "path": null,
        "sha256": null,
        "predictor_role": "predictor"
      },
      "reveal": {
        "status": "sealed",
        "authorized_by": [],
        "receipt_sha256": null
      }
    },
    {
      "candidate_id": "T1-005",
      "status": "eligible",
      "source": {
        "kind": "local_snapshot",
        "locator": "seed/evaluation/t1-holdout/sources/T1-005.README.md",
        "immutable_revision": "708ecbcd4f5d3ec1d11c987a4741d505358e7de9",
        "artifact_sha256": "afead27a36412966dd114584f672ed700fdaf82a5d594f26101f4b5c1bdd2bd1",
        "family_id": "JKHeadley",
        "license_id": "MIT",
        "license_evidence_path": "seed/evaluation/t1-holdout/licenses/T1-005.LICENSE.txt",
        "license_evidence_sha256": "3f2f90d0036b59d8cbfa6c269ba53044600d721d85294b01490bc5e6b20e8967"
      },
      "eligibility": {
        "source_hash_unseen": true,
        "family_unseen": true,
        "registry_overlap": false,
        "license_allowed": true,
        "reasons": []
      },
      "candidate_view": {
        "path": "seed/evaluation/t1-holdout/candidates/T1-005.view.json",
        "sha256": "d0299b34a04dce5a27b735d57454ba8f6ffb468966e1dbceb94d5cd97b89ebd4",
        "builder_role": "candidate_builder",
        "label_free": true
      },
      "oracle_commitment": {
        "path": "seed/evaluation/t1-oracles/T1-005.oracle.json",
        "sha256": "fd02a6afe99f2446b76439771eb948a52cae1923f3dd4b9ca175dbc8392e1ce6",
        "author_role": "oracle_author",
        "access": "sealed"
      },
      "prediction_receipt": {
        "status": "absent",
        "path": null,
        "sha256": null,
        "predictor_role": "predictor"
      },
      "reveal": {
        "status": "sealed",
        "authorized_by": [],
        "receipt_sha256": null
      }
    },
    {
      "candidate_id": "T1-006",